{
  "@type": "Card",
  "version": "1.0",
  "uid": "4a9d1e62-7b03-4c58-9f16-2e8a5d0c3b74",
  "prodId": "-//LumbreCode//WasThereSomething 1.6//EN",
  "created": "2026-08-25T09:12:00Z",
  "updated": "2026-08-25T09:12:00Z",
  "kind": "org",
  "name": {
    "full": "Beispiel GmbH"
  },
  "organizations": {
    "1": {
      "@type": "Organization",
      "name": "Beispiel GmbH"
    }
  }
}
