{
  "@type": "Card",
  "version": "1.0",
  "uid": "b28e4d70-9c15-4a3f-8e02-6d1b7f4a9c53",
  "prodId": "-//LumbreCode//WasThereSomething 1.6//EN",
  "created": "2026-08-25T09:12:00Z",
  "updated": "2026-08-25T09:12:00Z",
  "name": {
    "full": "Anna Weiss"
  },
  "emails": {
    "1": {
      "@type": "EmailAddress",
      "address": "anna@example.invalid",
      "contexts": {
        "private": true
      },
      "pref": 1
    },
    "2": {
      "@type": "EmailAddress",
      "address": "a.weiss@example.invalid",
      "contexts": {
        "work": true
      }
    }
  },
  "phones": {
    "1": {
      "@type": "Phone",
      "number": "+49 30 000000",
      "features": {
        "mobile": true,
        "text": true
      },
      "contexts": {
        "private": true
      }
    }
  }
}
