{
  "@type": "Card",
  "version": "1.0",
  "uid": "b28e4d70-9c15-4a3f-8e02-6d1b7f4a9c53",
  "prodId": "-//LumbreCode//WasThereSomething 1.6//EN",
  "created": "2026-08-25T09:12:00Z",
  "updated": "2026-08-25T09:12:00Z",
  "name": {
    "full": "Anna Weiss"
  },
  "relatedTo": {
    "7c1f0a35-2d84-4b6e-9a17-5f3c8e0d2b41": {
      "@type": "Relation",
      "relation": {
        "child": true
      }
    }
  }
}
